root@pravin-pc:/sys/bus/usb/drivers/usb-storage# usb-devices 

T:  Bus=01 Lev=00 Prnt=00 Port=00 Cnt=00 Dev#=  1 Spd=480 MxCh=12
D:  Ver= 2.00 Cls=09(hub  ) Sub=00 Prot=01 MxPS=64 #Cfgs=  1
P:  Vendor=1d6b ProdID=0002 Rev=05.15
S:  Manufacturer=Linux 5.15.0-67-generic xhci-hcd
S:  Product=xHCI Host Controller
S:  SerialNumber=0000:00:14.0
C:  #Ifs= 1 Cfg#= 1 Atr=e0 MxPwr=0mA
I:  If#=0x0 Alt= 0 #EPs= 1 Cls=09(hub  ) Sub=00 Prot=00 Driver=hub

T:  Bus=01 Lev=01 Prnt=01 Port=02 Cnt=01 Dev#=  4 Spd=480 MxCh= 0
D:  Ver= 2.00 Cls=00(>ifc ) Sub=00 Prot=00 MxPS=64 #Cfgs=  1
P:  Vendor=03f0 ProdID=1985 Rev=01.10
S:  Manufacturer=HP
S:  Product=USB Flash Drive
S:  SerialNumber=070D28D7AD16C804
C:  #Ifs= 1 Cfg#= 1 Atr=80 MxPwr=300mA
I:  If#=0x0 Alt= 0 #EPs= 2 Cls=08(stor.) Sub=06 Prot=50 Driver=(none)

T:  Bus=01 Lev=01 Prnt=01 Port=04 Cnt=02 Dev#=  2 Spd=480 MxCh= 0
D:  Ver= 2.01 Cls=ef(misc ) Sub=02 Prot=01 MxPS=64 #Cfgs=  1
P:  Vendor=0408 ProdID=5365 Rev=00.02
S:  Manufacturer=SunplusIT Inc
S:  Product=HP TrueVision HD Camera
C:  #Ifs= 2 Cfg#= 1 Atr=80 MxPwr=500mA
I:  If#=0x0 Alt= 0 #EPs= 1 Cls=0e(video) Sub=01 Prot=00 Driver=uvcvideo
I:  If#=0x1 Alt= 0 #EPs= 0 Cls=0e(video) Sub=02 Prot=00 Driver=uvcvideo

T:  Bus=01 Lev=01 Prnt=01 Port=05 Cnt=03 Dev#=  3 Spd=12  MxCh= 0
D:  Ver= 1.10 Cls=e0(wlcon) Sub=01 Prot=01 MxPS=64 #Cfgs=  1
P:  Vendor=0bda ProdID=b009 Rev=02.00
S:  Manufacturer=Realtek
S:  Product=802.11n WLAN Adapter
S:  SerialNumber=00e04c000001
C:  #Ifs= 2 Cfg#= 1 Atr=e0 MxPwr=500mA
I:  If#=0x0 Alt= 0 #EPs= 3 Cls=e0(wlcon) Sub=01 Prot=01 Driver=btusb
I:  If#=0x1 Alt= 0 #EPs= 2 Cls=e0(wlcon) Sub=01 Prot=01 Driver=btusb

T:  Bus=02 Lev=00 Prnt=00 Port=00 Cnt=00 Dev#=  1 Spd=5000 MxCh= 6
D:  Ver= 3.00 Cls=09(hub  ) Sub=00 Prot=03 MxPS= 9 #Cfgs=  1
P:  Vendor=1d6b ProdID=0003 Rev=05.15
S:  Manufacturer=Linux 5.15.0-67-generic xhci-hcd
S:  Product=xHCI Host Controller
S:  SerialNumber=0000:00:14.0
C:  #Ifs= 1 Cfg#= 1 Atr=e0 MxPwr=0mA
I:  If#=0x0 Alt= 0 #EPs= 1 Cls=09(hub  ) Sub=00 Prot=00 Driver=hub
root@pravin-pc:/sys/bus/usb/drivers/usb-storage# echo "1-3:1.0" > bind
root@pravin-pc:/sys/bus/usb/drivers/usb-storage# usb-devices 

T:  Bus=01 Lev=00 Prnt=00 Port=00 Cnt=00 Dev#=  1 Spd=480 MxCh=12
D:  Ver= 2.00 Cls=09(hub  ) Sub=00 Prot=01 MxPS=64 #Cfgs=  1
P:  Vendor=1d6b ProdID=0002 Rev=05.15
S:  Manufacturer=Linux 5.15.0-67-generic xhci-hcd
S:  Product=xHCI Host Controller
S:  SerialNumber=0000:00:14.0
C:  #Ifs= 1 Cfg#= 1 Atr=e0 MxPwr=0mA
I:  If#=0x0 Alt= 0 #EPs= 1 Cls=09(hub  ) Sub=00 Prot=00 Driver=hub

T:  Bus=01 Lev=01 Prnt=01 Port=02 Cnt=01 Dev#=  4 Spd=480 MxCh= 0
D:  Ver= 2.00 Cls=00(>ifc ) Sub=00 Prot=00 MxPS=64 #Cfgs=  1
P:  Vendor=03f0 ProdID=1985 Rev=01.10
S:  Manufacturer=HP
S:  Product=USB Flash Drive
S:  SerialNumber=070D28D7AD16C804
C:  #Ifs= 1 Cfg#= 1 Atr=80 MxPwr=300mA
I:  If#=0x0 Alt= 0 #EPs= 2 Cls=08(stor.) Sub=06 Prot=50 Driver=usb-storage

T:  Bus=01 Lev=01 Prnt=01 Port=04 Cnt=02 Dev#=  2 Spd=480 MxCh= 0
D:  Ver= 2.01 Cls=ef(misc ) Sub=02 Prot=01 MxPS=64 #Cfgs=  1
P:  Vendor=0408 ProdID=5365 Rev=00.02
S:  Manufacturer=SunplusIT Inc
S:  Product=HP TrueVision HD Camera
C:  #Ifs= 2 Cfg#= 1 Atr=80 MxPwr=500mA
I:  If#=0x0 Alt= 0 #EPs= 1 Cls=0e(video) Sub=01 Prot=00 Driver=uvcvideo
I:  If#=0x1 Alt= 0 #EPs= 0 Cls=0e(video) Sub=02 Prot=00 Driver=uvcvideo

T:  Bus=01 Lev=01 Prnt=01 Port=05 Cnt=03 Dev#=  3 Spd=12  MxCh= 0
D:  Ver= 1.10 Cls=e0(wlcon) Sub=01 Prot=01 MxPS=64 #Cfgs=  1
P:  Vendor=0bda ProdID=b009 Rev=02.00
S:  Manufacturer=Realtek
S:  Product=802.11n WLAN Adapter
S:  SerialNumber=00e04c000001
C:  #Ifs= 2 Cfg#= 1 Atr=e0 MxPwr=500mA
I:  If#=0x0 Alt= 0 #EPs= 3 Cls=e0(wlcon) Sub=01 Prot=01 Driver=btusb
I:  If#=0x1 Alt= 0 #EPs= 2 Cls=e0(wlcon) Sub=01 Prot=01 Driver=btusb

T:  Bus=02 Lev=00 Prnt=00 Port=00 Cnt=00 Dev#=  1 Spd=5000 MxCh= 6
D:  Ver= 3.00 Cls=09(hub  ) Sub=00 Prot=03 MxPS= 9 #Cfgs=  1
P:  Vendor=1d6b ProdID=0003 Rev=05.15
S:  Manufacturer=Linux 5.15.0-67-generic xhci-hcd
S:  Product=xHCI Host Controller
S:  SerialNumber=0000:00:14.0
C:  #Ifs= 1 Cfg#= 1 Atr=e0 MxPwr=0mA
I:  If#=0x0 Alt= 0 #EPs= 1 Cls=09(hub  ) Sub=00 Prot=00 Driver=hub
root@pravin-pc:/sys/bus/usb/drivers/usb-storage# 

